print;name;picture;flavor;check;remind;type;
0;Пыль веков;crypto/old_book.png;Книга, которую ты берешь в руки, рассыпается в прах. Облако густой, едкой пыли разлетается во все стороны!.. Прах и тлен окружают тебя мириадом мельчайших частичек, заставляя схватиться за горло и закашляться…;<b>Уничтожь этот</b> конверт и <b>начинай кашлять и чихать</b>.{2mm}Ты обязан немедленно <b>покинуть библиотеку</b> и НЕ возвращаться сюда, пока не подышишь свежим воздухом и не выкуришь Сигару.{2mm}{OR}{2mm}У тебя <b>начнется Приступ Болезни</b>.;;hazard;4
0;Ум или усидчивость?;crypto/note_paper.png;Выписки из архивов и каких-то научных статей, по большей части не на английском. Месяцы уйдут на то, чтобы разбирать это со словарем. Кто подбирал все это? По какому принципу?;{crypto_story_begin} нужно проставить на этом конверте 5 своих подписей.{2mm}Для этого проходи следующую Проверку:{2mm}1. Достань из мешка любое число Камней от 4 до 8.{1mm}2. Раскрась вытащенные Желтые Камни, если они есть.{1mm}3. Если среди полученных Камней Синих меньше, чем Красных и Зеленых вместе — верни все камни в мешок, поставь 1 подпись, но Проверка провалена.{1mm}Если же Синих больше, чем Красных и Зеленых вместе — Проверка пройдена, поставь столько подписей, сколько Синих Камней вытащено.{1mm}После этого верни в мешок все Красные и столько же Синих, все Зеленые и столько же Синих, остальные Синие сбрось.{1mm}В этом случае (если тебе не хватает подписей) ты сразу можешь делать Проверку повторно.;{check_reminder};;8
0;Точный расчет;crypto/note_paper.png;В твоих руках толстая папка, из которой вываливаются листы машинописного текста и какие-то фотокопии. На первый взгляд, это исследование на тему морского фольклора разных стран. Кто бы мог подумать, что в штатах такие сентиментальные военно-морские силы. Листы перепутаны. Но где-то же должна быть инструкция, к тому, как это читать!;{crypto_story_begin} нужно пройти следующую Проверку:{2mm}Вытащи из мешка, не глядя, и положи на стол 5 Камней. После этого вытаскивай Камни из мешка по одному, не глядя, и клади на стол. Как только на столе оказывается больше 6 Камней — сбрось любые, чтобы осталось 6. Проверку можно завершить в любой момент. Проверка пройдена, если среди лежащих на столе Камней есть <b>3 Синих, 1 Красный и 1 Зеленый</b>. При любом исходе Проверки верни все Камни со стола в мешок.;{check_reminder};;8
0;Боевая машина;crypto/note_paper.png;Похоже на какое-то руководство по рукопашному бою. Знающий человек быстро бы разобрался.;{crypto_story_begin} нужно сбросить из своего мешка 7 Синих Камней.{2mm}Это число уменьшается на 1 за каждое из выполненных тобой условий:{1mm}1) ты умеешь делать Захват,{1mm}2) ты умеешь делать 4 и больше Блоков,{1mm}3) ты умеешь делать 3 и больше Уклонений,{1mm}4) твой Статусный Паритет 3 и выше,{1mm}5) у тебя есть способность Статусный Предмет.;;;8
0;Записка;crypto/note_paper.png;Пачка листов с какими-то отчетами. Кто-то использовал их повторно и делал записи на обороте. Можно бегло пролистать из любопытства. ;{crypto_story_begin} пройди Проверку: {2mm}<b>Достань</b> из своего мешка <b>2 Камня</b>. Если среди них есть <b>хотя бы 1 Синий И 1 Зеленый</b> — Проверка пройдена.{2mm}При успехе проверки верни Камни обратно в мешок.{2mm}<b>При Провале — сбрось ОБА Камня</b>, и <b>еще столько случайных</b> Камней из мешка, <b>сколько Красных Камней ты вытащил</b> при Проверке.{2mm}{2mm}{crypto_story_suffix};{check_reminder};storyline;8
0;Аналитическая записка;crypto/secret.jpg;Документ вырван из контекста. Тот, для кого предназначалась записка, явно не нуждался в особенных подробностях. Но можно постараться и достроить общую картину. ;{crypto_story_begin} пройди Проверку: {2mm}<b>Достань</b> из своего мешка <b>2 Камня</b>. Если среди них есть <b>хотя бы 2 Синих</b> — Проверка пройдена.{2mm}В любом случае <b>сбрось 1 Синий</b> Камень из числа вытащенных, верни оставшиеся в руке Камни обратно в мешок.{2mm}{crypto_story_suffix};{check_reminder};storyline;20
0;Для служебного пользования;crypto/secret.jpg;Что-то похожее ты уже читал в National Geographic. Только это явно расширенная версия. Придется посмотреть повнимательнее — в Пентагоне плохого не посоветуют!;{crypto_story_begin} пройди Проверку: {2mm}Сначала <b>сбрось из мешка 1 Зеленый</b> Камень, чтобы приступить к Проверке.{2mm}Потом <b>достань</b> из своего мешка <b>2 Камня</b>. Если среди них есть <b>хотя бы 1 Синий</b> — Проверка пройдена.{2mm}В любом случае <b>сбрось 1 Синий</b> Камень из числа вытащенных, верни оставшийся в руке Камень обратно в мешок.{2mm}{crypto_story_suffix};{check_reminder};storyline;16
0;Унылые отчеты;crypto/secret.jpg;Папка с эмблемой министерства здравоохранения. {quot}Комиссия по…{quot} Аааааапчхи! Черт. Пыльно тут. Ааапчхи!;{crypto_story_begin} пройди Проверку: {2mm}Сначала <b>сбрось из мешка 1 Зеленый</b> Камень, чтобы приступить к Проверке.{2mm}Потом <b>достань</b> из своего мешка <b>3 Камня</b>. Если среди них есть <b>хотя бы 1 Синий И 1 Зеленый</b> — Проверка пройдена.{2mm}В любом случае <b>сбрось 1 Синий и 1 Зеленый</b> Камни из числа вытащенных, верни оставшийся в руке Камень обратно в мешок.{2mm}{crypto_story_suffix};{check_reminder};storyline;16
0;Агентурная записка;crypto/secret.jpg;На обложке этой толстой папки стоит размашистая уверенная резолюция: {quot}Не представляет ценности. В архив. Генерал Кавендиш.{quot} Велик соблазн согласиться с генералом и поискать что-нибудь поинтереснее.;{crypto_story_begin} пройди Проверку: {2mm}Сначала <b>сбрось из мешка 1 Зеленый</b> Камень, чтобы приступить к Проверке.{2mm}Потом <b>достань</b> из своего мешка <b>2 Камня</b>. Если среди них есть <b>хотя бы 2 Синих</b> — Проверка пройдена.{2mm}Верни вытащенные Синие Камни обратно в мешок, сбрось вытащенные Зеленые и Красные.{2mm}{crypto_story_suffix};{check_reminder};storyline;16
0;Старые архивы;crypto/secret.jpg;Еще одна архивная папка. Почему-то очень не хочется заглядывать внутрь. Так выглядят конверты, в которых затаились плохие новости. Или счет, по которому с тебя вот-вот взыщут. ;{crypto_story_begin} пройди Проверку: {2mm}Сначала <b>сбрось из мешка 2 Зеленых</b> Камня, чтобы приступить к Проверке.{2mm}Потом <b>достань</b> из своего мешка <b>5 Камней</b>. Если среди них есть <b>хотя бы 2 Синих и 1 Зеленый</b> — Проверка пройдена.{2mm}В любом случае <b>сбрось все</b> вытащенные в ходе Проверки Камни.{2mm}{crypto_story_suffix};{check_reminder};storyline;16
0;Шифровка?;crypto/secret.jpg;Если они не хотят, чтобы мы это прочли, почему пускают в архив? Хорошо, что ты в детстве читал {quot}Основы криптоанализа{quot}. Систему будет найти легко…;{crypto_story_begin} пройди Проверку: {2mm}<b>Достань</b> из своего мешка <b>5 Камней</b>. Если среди них есть <b>хотя бы 5 Синих и\или Зеленых</b> и <b>представлены ОБА этих цвета</b> — Проверка пройдена.{2mm}В любом случае <b>сбрось 3 Камня</b> из числа вытащенных, верни оставшиеся обратно в мешок.{2mm}{crypto_story_suffix};{check_reminder};storyline;16
0;Только для ваших глаз;crypto/secret.jpg;Текст на иностранном языке. Кажется немецкий или шведский. Видно, что писавший сильно торопился: почерк неразборчивый, а в самом тексте полно неочевидных сокращений.;{crypto_story_begin} пройди Проверку: {2mm}<b>Достань</b> из своего мешка <b>3 Камня</b>. Если среди них есть <b>хотя бы 2 Синих</b> — Проверка пройдена.{2mm}В любом случае, <b>верни вытащенные</b> Камни обратно в мешок и <b>сбрось после этого 1 случайный</b> Камень из мешка.{2mm}{crypto_story_suffix};{check_reminder};storyline;16
0;Класс С;crypto/secret.jpg;Каждое предложение приходится перечитывать по несколько раз, чтобы запомнить, словно ты читаешь Гегеля с сильного похмелья. Что это? Автономный военный гипноз или просто кому-то не хватает писательского таланта?;{crypto_story_begin} пройди Проверку: {2mm}Сначала <b>сбрось из мешка 1 Зеленый</b> Камень, чтобы приступить к Проверке.{2mm}<b>Достань</b> из своего мешка <b>5 Камней</b>. Если среди них есть <b>хотя бы 2 Синих и 2 Зеленых</b> — Проверка пройдена.{2mm}В любом случае <b>сбрось 1 Синий и 1 Зеленый</b> Камни из числа вытащенных, верни оставшиеся в руке Камни обратно в мешок.{2mm}{crypto_story_suffix};{check_reminder};storyline;16
0;Секретные материалы;crypto/top_secret.jpg;Совершенно секретный отчет. К тому же зашифрованный. Впрочем, за последние 20 лет военные криптографы, похоже, ничего нового не придумали. ;{crypto_story_begin} пройди Проверку: {2mm}Сначала <b>сбрось из мешка 1 Зеленый и 1 Синий</b> Камень, чтобы приступить к Проверке.{2mm}Потом <b>достань</b> из своего мешка <b>4 Камня</b>. Если среди них есть <b>хотя бы 4 Синих ИЛИ 4 Зеленых</b> — Проверка пройдена.{2mm}В любом случае <b>сбрось 2 Камня</b> из числа вытащенных, верни оставшиеся в руке Камни обратно в мешок.{2mm}{crypto_story_suffix};{check_reminder};storyline;12
0;Совершенно секретно;crypto/top_secret.jpg;Тонкая папка. Совершенно секретно, лучшее, что вы сможете сделать — застрелиться перед прочтением. Ничего не понятно, только столбцы цифр. Но, раз у тебя есть доступ к этому документу, значит есть и доступ к дешифровальной машине. Или нет?..;{crypto_story_begin} пройди Проверку: {2mm}Сначала <b>сбрось из мешка 1 Зеленый и 1 Синий</b> Камень, чтобы приступить к Проверке.{2mm}Потом <b>достань</b> из своего мешка <b>5 Камней</b>. Если среди них есть <b>хотя бы 4 Синих</b> — Проверка пройдена.{2mm}В любом случае <b>сбрось 2 Синих</b> Камня из числа вытащенных, верни оставшиеся в руке Камни обратно в мешок.{2mm}{crypto_story_suffix};{check_reminder};storyline;12
0;Доступ Ультра;crypto/top_secret.jpg;Совершенно секретно. Особой важности. Сухая казенная формулировка означает, что даже держать эту папку в руках без соответствующего уровня допуска — уже преступление. Внутри убийственный шифр, который не расколоть без дешифровальнйо машины. Лучше аккуратно вернуть ее на место прямо сейчас, тихонько выйти и навсегда покинуть страну.;{crypto_story_begin} пройди Проверку: {2mm}Сначала <b>сбрось из мешка 1 Зеленый и 1 Синий</b> Камень, чтобы приступить к Проверке.{2mm}Потом <b>достань</b> из своего мешка <b>5 Камней</b>. Если среди них есть <b>хотя бы 5 Синих и 1 Зеленый</b> — Проверка пройдена.{2mm}В любом случае <b>сбрось 3</b> Камня из числа вытащенных, верни оставшиеся в руке Камни обратно в мешок.{2mm}{crypto_story_suffix};{check_reminder};storyline;12
3;Осколки технологий;crypto/top_secret.gif;Затопленные подземные лаборатории в катакомбах под Салемом таят немало осколков прежних технологий. Запретных и очень опасных технологий.;Конверт ПОКА НЕ выразим (храни его в книжке).{1mm}Он станет выразим, когда ты прочитаешь хотя бы один крипто-документ с грифом «SECRET» или «TOP SECRET»<hr/>{science_game};{check_reminder};storyline;
3;Осколки технологий;crypto/top_secret.gif;Затопленные подземные лаборатории в катакомбах под Салемом таят немало осколков прежних технологий. Запретных и очень опасных технологий.;Конверт ПОКА НЕ выразим (храни его в книжке).{1mm}Он станет выразим, когда ты восстановишь хотя бы одно Забытое Воспоминание, или станешь свидетелем чужого<hr/>{science_game};{check_reminder};storyline;
3;Осколки технологий;crypto/top_secret.gif;Затопленные подземные лаборатории в катакомбах под Салемом таят немало осколков прежних технологий. Запретных и очень опасных технологий.;Конверт ПОКА НЕ выразим (храни его в книжке).{1mm}Он станет выразим, когда ты потратишь 9 Синих Камней<hr/>{science_game};{check_reminder};storyline;
3;Осколки технологий;crypto/top_secret.gif;Затопленные подземные лаборатории в катакомбах под Салемом таят немало осколков прежних технологий. Запретных и очень опасных технологий.;Конверт ПОКА НЕ выразим (храни его в книжке).{1mm}Он станет выразим, когда ты потратишь 9 Красных Камней<hr/>{science_game};{check_reminder};storyline;
3;Осколки технологий;crypto/top_secret.gif;Затопленные подземные лаборатории в катакомбах под Салемом таят немало осколков прежних технологий. Запретных и очень опасных технологий.;Конверт ПОКА НЕ выразим (храни его в книжке).{1mm}Он станет выразим, когда ты потратишь 9 Зеленых Камней <hr/>{science_game};{check_reminder};storyline;
3;Осколки технологий;crypto/top_secret.gif;Затопленные подземные лаборатории в катакомбах под Салемом таят немало осколков прежних технологий. Запретных и очень опасных технологий.;Конверт ПОКА НЕ выразим (храни его в книжке).{1mm}Он станет выразим, когда ты потратишь Желтый Камень<hr/>{science_game};{check_reminder};storyline;
3;Осколки технологий;crypto/top_secret.gif;Затопленные подземные лаборатории в катакомбах под Салемом таят немало осколков прежних технологий. Запретных и очень опасных технологий.;Конверт ПОКА НЕ выразим (храни его в книжке).{1mm}Он станет выразим, когда ты поговоришь с Фоссетом и признаешь его правоту или публично выразишь несогласие<hr/>{science_game};{check_reminder};storyline;
3;Осколки технологий;crypto/top_secret.gif;Затопленные подземные лаборатории в катакомбах под Салемом таят немало осколков прежних технологий. Запретных и очень опасных технологий.;Конверт ПОКА НЕ выразим (храни его в книжке).{1mm}Он станет выразим, когда ты поговоришь с Алым Королем и признаешь его правоту или публично выразишь несогласие<hr/>{science_game};{check_reminder};storyline;
3;Осколки технологий;crypto/top_secret.gif;Затопленные подземные лаборатории в катакомбах под Салемом таят немало осколков прежних технологий. Запретных и очень опасных технологий.;Конверт ПОКА НЕ выразим (храни его в книжке).{1mm}Он станет выразим, когда ты лично станешь свидетелем хотя бы ПЯТИ разных фантастических сцен в Гипнозе<hr/>{science_game};{check_reminder};storyline;
